{
  "books": [
    {
      "creators": [
        {
          "evidence": [
            "books/dokumen-pub-a-philosophy-of-software-design-2nd-edition-2nbsped-173210221x-9781732102217/chapters/002-title-page.md"
          ],
          "name": "John K. Ousterhout",
          "role": "author",
          "support": "direct"
        }
      ],
      "edition": {
        "evidence": [
          "books/dokumen-pub-a-philosophy-of-software-design-2nd-edition-2nbsped-173210221x-9781732102217/chapters/003-copyright.md"
        ],
        "label": "Second edition",
        "number": 2,
        "support": "direct"
      },
      "generated_metadata_status": "legacy-extracted-noncanonical",
      "slug": "dokumen-pub-a-philosophy-of-software-design-2nd-edition-2nbsped-173210221x-9781732102217",
      "source_id": "SRC-APOSD",
      "source_path": "sources/dokumen.pub_a-philosophy-of-software-design-2nd-edition-2nbsped-173210221x-9781732102217.epub",
      "title": "A Philosophy of Software Design",
      "title_evidence": [
        "books/dokumen-pub-a-philosophy-of-software-design-2nd-edition-2nbsped-173210221x-9781732102217/chapters/002-title-page.md"
      ]
    },
    {
      "creators": [
        {
          "evidence": [
            "books/clean-architecture-a-craftsman-guide-to-software-structure-and-design/chapters/001-clean-architecture.md"
          ],
          "name": "Robert C. Martin",
          "role": "author",
          "support": "direct"
        },
        {
          "evidence": [
            "books/clean-architecture-a-craftsman-guide-to-software-structure-and-design/chapters/001-clean-architecture.md"
          ],
          "name": "James Grenning",
          "role": "contributor",
          "support": "direct"
        },
        {
          "evidence": [
            "books/clean-architecture-a-craftsman-guide-to-software-structure-and-design/chapters/001-clean-architecture.md"
          ],
          "name": "Simon Brown",
          "role": "contributor",
          "support": "direct"
        }
      ],
      "edition": {
        "evidence": [
          "books/clean-architecture-a-craftsman-guide-to-software-structure-and-design/chapters/001-clean-architecture.md"
        ],
        "label": "First edition",
        "number": 1,
        "support": "derived-inference"
      },
      "generated_metadata_status": "legacy-extracted-noncanonical",
      "slug": "clean-architecture-a-craftsman-guide-to-software-structure-and-design",
      "source_id": "SRC-CA",
      "source_path": "sources/Clean Architecture A Craftsman Guide to Software Structure and Design.pdf",
      "title": "Clean Architecture: A Craftsman's Guide to Software Structure and Design",
      "title_evidence": [
        "books/clean-architecture-a-craftsman-guide-to-software-structure-and-design/chapters/001-clean-architecture.md"
      ]
    },
    {
      "creators": [
        {
          "evidence": [
            "books/code-complete-2nd-edition-v413hav/chapters/001-complete.md"
          ],
          "name": "Steve McConnell",
          "role": "author",
          "support": "direct"
        }
      ],
      "edition": {
        "evidence": [
          "books/code-complete-2nd-edition-v413hav/chapters/001-complete.md"
        ],
        "label": "Second edition",
        "number": 2,
        "support": "direct"
      },
      "generated_metadata_status": "legacy-extracted-noncanonical",
      "slug": "code-complete-2nd-edition-v413hav",
      "source_id": "SRC-CC",
      "source_path": "sources/code-complete-2nd-edition-v413hav.pdf",
      "title": "Code Complete: A Practical Handbook of Software Construction",
      "title_evidence": [
        "books/code-complete-2nd-edition-v413hav/chapters/001-complete.md"
      ]
    },
    {
      "creators": [
        {
          "evidence": [
            "books/domain-driven-design-tackling-complexity-in-the-heart-of-software-eric-evans/chapters/001-domain-driven-dissign.md"
          ],
          "name": "Eric Evans",
          "role": "author",
          "support": "direct"
        },
        {
          "evidence": [
            "books/domain-driven-design-tackling-complexity-in-the-heart-of-software-eric-evans/chapters/001-domain-driven-dissign.md"
          ],
          "name": "Martin Fowler",
          "role": "foreword-author",
          "support": "direct"
        }
      ],
      "edition": {
        "evidence": [
          "sources/Domain Driven Design Tackling Complexity in the Heart of Software - Eric Evans.pdf",
          "books/domain-driven-design-tackling-complexity-in-the-heart-of-software-eric-evans/chapters/001-domain-driven-dissign.md"
        ],
        "label": "First edition",
        "number": 1,
        "support": "derived-inference"
      },
      "generated_metadata_status": "legacy-extracted-noncanonical",
      "slug": "domain-driven-design-tackling-complexity-in-the-heart-of-software-eric-evans",
      "source_id": "SRC-DDD",
      "source_path": "sources/Domain Driven Design Tackling Complexity in the Heart of Software - Eric Evans.pdf",
      "title": "Domain-Driven Design: Tackling Complexity in the Heart of Software",
      "title_evidence": [
        "sources/Domain Driven Design Tackling Complexity in the Heart of Software - Eric Evans.pdf",
        "books/domain-driven-design-tackling-complexity-in-the-heart-of-software-eric-evans/chapters/001-domain-driven-dissign.md"
      ]
    },
    {
      "creators": [
        {
          "evidence": [
            "books/efficient-go-data-driven-performance-optimization-bartlomiej-plotka-z-library/chapters/001-data-driven-performance-optimizations.md"
          ],
          "name": "Bartłomiej Płotka",
          "role": "author",
          "support": "direct"
        }
      ],
      "edition": {
        "evidence": [
          "books/efficient-go-data-driven-performance-optimization-bartlomiej-plotka-z-library/chapters/001-data-driven-performance-optimizations.md"
        ],
        "label": "First edition",
        "number": 1,
        "support": "direct"
      },
      "generated_metadata_status": "legacy-extracted-noncanonical",
      "slug": "efficient-go-data-driven-performance-optimization-bartlomiej-plotka-z-library",
      "source_id": "SRC-EGO",
      "source_path": "sources/Efficient Go Data-Driven Performance Optimization (Bartlomiej Plotka) (Z-Library).pdf",
      "title": "Efficient Go: Data-Driven Performance Optimization",
      "title_evidence": [
        "sources/Efficient Go Data-Driven Performance Optimization (Bartlomiej Plotka) (Z-Library).pdf",
        "books/efficient-go-data-driven-performance-optimization-bartlomiej-plotka-z-library/chapters/001-data-driven-performance-optimizations.md"
      ]
    },
    {
      "creators": [
        {
          "evidence": [
            "books/fluent-python-2nd-edition-z-lib-org/chapters/001-fluent-python.md"
          ],
          "name": "Luciano Ramalho",
          "role": "author",
          "support": "direct"
        }
      ],
      "edition": {
        "evidence": [
          "books/fluent-python-2nd-edition-z-lib-org/chapters/001-fluent-python.md"
        ],
        "label": "Second edition",
        "number": 2,
        "support": "direct"
      },
      "generated_metadata_status": "legacy-extracted-noncanonical",
      "slug": "fluent-python-2nd-edition-z-lib-org",
      "source_id": "SRC-FP",
      "source_path": "sources/Fluent.Python.2nd.Edition.(z-lib.org).pdf",
      "title": "Fluent Python",
      "title_evidence": [
        "books/fluent-python-2nd-edition-z-lib-org/chapters/001-fluent-python.md"
      ]
    },
    {
      "creators": [
        {
          "evidence": [
            "books/oreilly-fundamentals-of-software-architecture-2020-1/chapters/001-fundamentals-of-software-architecture.md"
          ],
          "name": "Mark Richards",
          "role": "author",
          "support": "direct"
        },
        {
          "evidence": [
            "books/oreilly-fundamentals-of-software-architecture-2020-1/chapters/001-fundamentals-of-software-architecture.md"
          ],
          "name": "Neal Ford",
          "role": "author",
          "support": "direct"
        }
      ],
      "edition": {
        "evidence": [
          "books/oreilly-fundamentals-of-software-architecture-2020-1/chapters/001-fundamentals-of-software-architecture.md"
        ],
        "label": "First edition",
        "number": 1,
        "support": "direct"
      },
      "generated_metadata_status": "legacy-extracted-noncanonical",
      "slug": "oreilly-fundamentals-of-software-architecture-2020-1",
      "source_id": "SRC-FSA",
      "source_path": "sources/OReilly.Fundamentals.of.Software.Architecture.2020.1.pdf",
      "title": "Fundamentals of Software Architecture: An Engineering Approach",
      "title_evidence": [
        "books/oreilly-fundamentals-of-software-architecture-2020-1/chapters/001-fundamentals-of-software-architecture.md"
      ]
    },
    {
      "creators": [
        {
          "evidence": [
            "books/refactoring-improving-the-design-of-existing-code/chapters/001-refactoring-improving-the-design-of-existing-code.md"
          ],
          "name": "Martin Fowler",
          "role": "author",
          "support": "direct"
        },
        {
          "evidence": [
            "books/refactoring-improving-the-design-of-existing-code/chapters/004-acknowledgments.md"
          ],
          "name": "Kent Beck",
          "role": "contributor",
          "support": "direct"
        },
        {
          "evidence": [
            "books/refactoring-improving-the-design-of-existing-code/chapters/004-acknowledgments.md"
          ],
          "name": "John Brant",
          "role": "contributor",
          "support": "direct"
        },
        {
          "evidence": [
            "books/refactoring-improving-the-design-of-existing-code/chapters/004-acknowledgments.md"
          ],
          "name": "William Opdyke",